{
  "$schema": "https://json-schema.org/draft/2020-12/schema",
  "$id": "https://local.sports-research/schema/analysis_request.schema.json",
  "title": "Sports analysis-only live request",
  "type": "object",
  "additionalProperties": false,
  "required": ["schema_version", "analysis_id", "sport_family", "competition_id", "market_family", "forecast_state", "as_of_utc", "participants", "source_observations", "live_state"],
  "properties": {
    "schema_version": { "const": "SPORTS_ANALYSIS_REQUEST_V1" },
    "analysis_id": { "type": "string", "pattern": "^[A-Za-z0-9][A-Za-z0-9._:-]{2,127}$" },
    "sport_family": { "enum": ["Baseball", "Cricket", "Soccer", "Australian football", "Rugby league"] },
    "competition_id": { "type": "string", "pattern": "^[A-Z0-9_:-]{2,64}$" },
    "market_family": { "const": "winner" },
    "forecast_state": { "const": "LIVE" },
    "as_of_utc": { "$ref": "#/$defs/utc" },
    "participants": {
      "type": "array", "minItems": 2, "maxItems": 2,
      "items": {
        "type": "object", "additionalProperties": false,
        "required": ["participant_id", "name"],
        "properties": {
          "participant_id": { "type": "string", "pattern": "^[A-Za-z0-9][A-Za-z0-9._:-]{0,63}$" },
          "name": { "type": "string", "minLength": 1, "maxLength": 160 }
        }
      }
    },
    "source_observations": {
      "type": "array", "minItems": 1, "maxItems": 8,
      "items": {
        "type": "object", "additionalProperties": false,
        "required": ["source_id", "source_url", "observed_at_utc", "fetched_at_utc", "content_hash"],
        "properties": {
          "source_id": { "type": "string", "pattern": "^[A-Z0-9_:-]{2,80}$" },
          "source_url": { "type": "string", "pattern": "^https://" },
          "observed_at_utc": { "$ref": "#/$defs/utc" },
          "fetched_at_utc": { "$ref": "#/$defs/utc" },
          "content_hash": { "$ref": "#/$defs/sha256" }
        }
      }
    },
    "live_state": { "type": "object" }
  },
  "allOf": [
    {
      "if": { "properties": { "sport_family": { "const": "Baseball" } }, "required": ["sport_family"] },
      "then": { "properties": { "live_state": { "$ref": "#/$defs/baseball" } } }
    },
    {
      "if": { "properties": { "sport_family": { "const": "Cricket" } }, "required": ["sport_family"] },
      "then": { "properties": { "live_state": { "$ref": "#/$defs/cricket" } } }
    },
    {
      "if": { "properties": { "sport_family": { "const": "Soccer" } }, "required": ["sport_family"] },
      "then": { "properties": { "live_state": { "$ref": "#/$defs/soccer" } } }
    },
    {
      "if": { "properties": { "sport_family": { "const": "Australian football" } }, "required": ["sport_family"] },
      "then": { "properties": { "live_state": { "$ref": "#/$defs/afl" } } }
    },
    {
      "if": { "properties": { "sport_family": { "const": "Rugby league" } }, "required": ["sport_family"] },
      "then": { "properties": { "live_state": { "$ref": "#/$defs/nrl" } } }
    }
  ],
  "$defs": {
    "utc": { "type": "string", "pattern": "^\\d{4}-\\d{2}-\\d{2}T\\d{2}:\\d{2}:\\d{2}(?:\\.\\d{3})?Z$" },
    "sha256": { "type": "string", "pattern": "^[a-f0-9]{64}$" },
    "baseball": {
      "type": "object", "additionalProperties": false,
      "required": ["away_participant_id", "home_participant_id", "away_runs", "home_runs", "inning", "half", "outs", "scheduled_innings", "bases_occupied", "game_status"],
      "properties": {
        "away_participant_id": { "type": "string" }, "home_participant_id": { "type": "string" },
        "away_runs": { "type": "integer", "minimum": 0 }, "home_runs": { "type": "integer", "minimum": 0 },
        "inning": { "type": "integer", "minimum": 1, "maximum": 30 }, "half": { "enum": ["TOP", "BOTTOM"] },
        "outs": { "type": "integer", "minimum": 0, "maximum": 2 }, "scheduled_innings": { "type": "integer", "minimum": 5, "maximum": 20 },
        "bases_occupied": { "type": "array", "uniqueItems": true, "maxItems": 3, "items": { "enum": ["FIRST", "SECOND", "THIRD"] } },
        "game_status": { "const": "IN_PROGRESS" }
      }
    },
    "cricket": {
      "type": "object", "additionalProperties": false,
      "required": ["first_batting_participant_id", "chasing_participant_id", "innings_number", "target_basis", "target_runs", "current_runs", "wickets_lost", "balls_bowled", "scheduled_balls", "max_wickets", "first_innings_runs", "first_innings_balls", "game_status"],
      "properties": {
        "first_batting_participant_id": { "type": "string" }, "chasing_participant_id": { "type": "string" },
        "innings_number": { "const": 2 }, "target_basis": { "const": "STANDARD" }, "target_runs": { "type": "integer", "minimum": 1 }, "current_runs": { "type": "integer", "minimum": 0 },
        "wickets_lost": { "type": "integer", "minimum": 0, "maximum": 10 }, "balls_bowled": { "type": "integer", "minimum": 0, "maximum": 599 },
        "scheduled_balls": { "type": "integer", "minimum": 1, "maximum": 600 }, "max_wickets": { "type": "integer", "minimum": 1, "maximum": 10 },
        "first_innings_runs": { "type": "integer", "minimum": 0 }, "first_innings_balls": { "type": "integer", "minimum": 1, "maximum": 600 },
        "game_status": { "const": "IN_PROGRESS" }
      }
    },
    "soccer": {
      "type": "object", "additionalProperties": false,
      "required": ["home_participant_id", "away_participant_id", "home_goals", "away_goals", "elapsed_minutes", "regulation_minutes", "home_red_cards", "away_red_cards", "period", "game_status"],
      "properties": {
        "home_participant_id": { "type": "string" }, "away_participant_id": { "type": "string" },
        "home_goals": { "type": "integer", "minimum": 0 }, "away_goals": { "type": "integer", "minimum": 0 },
        "elapsed_minutes": { "type": "number", "minimum": 0, "maximum": 130 }, "regulation_minutes": { "type": "integer", "minimum": 80, "maximum": 120 },
        "home_red_cards": { "type": "integer", "minimum": 0, "maximum": 5 }, "away_red_cards": { "type": "integer", "minimum": 0, "maximum": 5 },
        "period": { "enum": ["FIRST_HALF", "HALFTIME", "SECOND_HALF"] }, "game_status": { "const": "IN_PROGRESS" }
      }
    },
    "afl": {
      "type": "object", "additionalProperties": false,
      "required": ["home_participant_id", "away_participant_id", "home_points", "away_points", "period_number", "seconds_remaining_in_period", "nominal_period_seconds", "game_status"],
      "properties": {
        "home_participant_id": { "type": "string" }, "away_participant_id": { "type": "string" },
        "home_points": { "type": "integer", "minimum": 0 }, "away_points": { "type": "integer", "minimum": 0 },
        "period_number": { "type": "integer", "minimum": 1, "maximum": 4 }, "seconds_remaining_in_period": { "type": "integer", "minimum": 0, "maximum": 2400 },
        "nominal_period_seconds": { "type": "integer", "minimum": 600, "maximum": 2400 }, "game_status": { "const": "IN_PROGRESS" }
      }
    },
    "nrl": {
      "type": "object", "additionalProperties": false,
      "required": ["home_participant_id", "away_participant_id", "home_points", "away_points", "elapsed_minutes", "regulation_minutes", "period", "game_status"],
      "properties": {
        "home_participant_id": { "type": "string" }, "away_participant_id": { "type": "string" },
        "home_points": { "type": "integer", "minimum": 0 }, "away_points": { "type": "integer", "minimum": 0 },
        "elapsed_minutes": { "type": "number", "minimum": 0, "maximum": 100 }, "regulation_minutes": { "type": "integer", "minimum": 70, "maximum": 100 },
        "period": { "enum": ["FIRST_HALF", "HALFTIME", "SECOND_HALF", "GOLDEN_POINT"] }, "game_status": { "const": "IN_PROGRESS" }
      }
    }
  }
}
