{
  "schema_version": "SPORTS_ANALYSIS_REQUEST_V1",
  "analysis_id": "<UNIQUE_ANALYSIS_ID>",
  "sport_family": "Australian football",
  "competition_id": "AFL",
  "market_family": "winner",
  "forecast_state": "LIVE",
  "as_of_utc": "<UTC_TIMESTAMP>",
  "participants": [
    { "participant_id": "<HOME_ID>", "name": "<HOME_NAME>" },
    { "participant_id": "<AWAY_ID>", "name": "<AWAY_NAME>" }
  ],
  "source_observations": [
    {
      "source_id": "AFL_FIXTURE",
      "source_url": "<EXACT_HTTPS_AFL_URL>",
      "observed_at_utc": "<UTC_TIMESTAMP>",
      "fetched_at_utc": "<UTC_TIMESTAMP>",
      "content_hash": "<SHA256_OF_RETAINED_SOURCE_SNAPSHOT>"
    }
  ],
  "live_state": {
    "home_participant_id": "<HOME_ID>",
    "away_participant_id": "<AWAY_ID>",
    "home_points": 0,
    "away_points": 0,
    "period_number": 1,
    "seconds_remaining_in_period": 1200,
    "nominal_period_seconds": 1200,
    "game_status": "IN_PROGRESS"
  }
}
